{
  "$schema": "../../../schemas/golden-corpus.schema.json",
  "contractId": "fixtures.visual-golden-corpus.v1",
  "schemaVersion": 1,
  "seed": 163,
  "dimensions": {
    "origin": [
      "observed",
      "reported",
      "inferred",
      "derived"
    ],
    "verification": [
      "unverified",
      "verified",
      "corroborated",
      "disputed",
      "contradicted"
    ],
    "completeness": [
      "complete",
      "partial",
      "missing",
      "unknown",
      "withheld"
    ],
    "confidence": [
      "high",
      "medium",
      "low"
    ],
    "health": [
      "healthy",
      "degraded",
      "failed",
      "unknown"
    ],
    "process": [
      "idle",
      "waiting",
      "blocked",
      "retrying",
      "waiting-review",
      "completed",
      "rolled-back",
      "acknowledged"
    ],
    "change": [
      "unchanged",
      "added",
      "removed",
      "modified",
      "moved",
      "mixed"
    ],
    "provenance": [
      "human",
      "ai-assisted",
      "tool",
      "mixed"
    ]
  },
  "scenarios": [
    {
      "id": "fixture.verified-complete",
      "version": 1,
      "entity": {
        "id": "entity-01",
        "type": "evidence",
        "label": "Synthetic evidence 1"
      },
      "epistemic": {
        "origin": "observed",
        "verification": "verified",
        "completeness": "complete",
        "confidence": "high"
      },
      "trust": {
        "privacy": "internal",
        "jurisdiction": "local"
      },
      "health": "healthy",
      "process": {
        "state": "idle",
        "attempt": 1
      },
      "change": "unchanged",
      "provenance": {
        "mode": "human",
        "sources": [
          "source-a"
        ]
      },
      "time": {
        "kind": "exact",
        "timezone": "Asia/Jakarta"
      },
      "location": null,
      "attention": "normal",
      "representations": [
        "table",
        "graph",
        "timeline",
        "inspector",
        "document",
        "print"
      ]
    },
    {
      "id": "fixture.reported-disputed",
      "version": 1,
      "entity": {
        "id": "entity-02",
        "type": "evidence",
        "label": "Synthetic evidence 2"
      },
      "epistemic": {
        "origin": "reported",
        "verification": "disputed",
        "completeness": "partial",
        "confidence": "medium"
      },
      "trust": {
        "privacy": "internal",
        "jurisdiction": "local"
      },
      "health": "healthy",
      "process": {
        "state": "idle",
        "attempt": 1
      },
      "change": "unchanged",
      "provenance": {
        "mode": "human",
        "sources": [
          "source-a"
        ]
      },
      "time": {
        "kind": "exact",
        "timezone": "Asia/Jakarta"
      },
      "location": null,
      "attention": "normal",
      "representations": [
        "table",
        "graph",
        "timeline",
        "inspector",
        "document"
      ]
    },
    {
      "id": "fixture.inferred-medium",
      "version": 1,
      "entity": {
        "id": "entity-03",
        "type": "relation",
        "label": "Synthetic relation 3"
      },
      "epistemic": {
        "origin": "inferred",
        "verification": "unverified",
        "completeness": "partial",
        "confidence": "medium"
      },
      "trust": {
        "privacy": "internal",
        "jurisdiction": "local"
      },
      "health": "healthy",
      "process": {
        "state": "idle",
        "attempt": 1
      },
      "change": "unchanged",
      "provenance": {
        "mode": "ai-assisted",
        "sources": [
          "source-a"
        ]
      },
      "time": {
        "kind": "exact",
        "timezone": "Asia/Jakarta"
      },
      "location": null,
      "attention": "normal",
      "representations": [
        "graph",
        "timeline",
        "inspector"
      ]
    },
    {
      "id": "fixture.unresolved-identity",
      "version": 1,
      "entity": {
        "id": "entity-04",
        "type": "entity",
        "label": "Synthetic entity 4"
      },
      "epistemic": {
        "origin": "reported",
        "verification": "unverified",
        "completeness": "partial",
        "confidence": "low"
      },
      "trust": {
        "privacy": "internal",
        "jurisdiction": "local"
      },
      "health": "healthy",
      "process": {
        "state": "waiting",
        "attempt": 1
      },
      "change": "unchanged",
      "provenance": {
        "mode": "mixed",
        "sources": [
          "source-a"
        ]
      },
      "time": {
        "kind": "exact",
        "timezone": "Asia/Jakarta"
      },
      "location": null,
      "attention": "normal",
      "representations": [
        "table",
        "graph",
        "inspector"
      ]
    },
    {
      "id": "fixture.missing-source",
      "version": 1,
      "entity": {
        "id": "entity-05",
        "type": "evidence",
        "label": "Synthetic evidence 5"
      },
      "epistemic": {
        "origin": "reported",
        "verification": "unverified",
        "completeness": "missing",
        "confidence": "low"
      },
      "trust": {
        "privacy": "internal",
        "jurisdiction": "local"
      },
      "health": "healthy",
      "process": {
        "state": "blocked",
        "attempt": 1
      },
      "change": "unchanged",
      "provenance": {
        "mode": "human",
        "sources": [
          "source-a"
        ]
      },
      "time": {
        "kind": "exact",
        "timezone": "Asia/Jakarta"
      },
      "location": null,
      "attention": "normal",
      "representations": [
        "table",
        "graph",
        "timeline",
        "inspector",
        "document"
      ]
    },
    {
      "id": "fixture.stale-healthy",
      "version": 1,
      "entity": {
        "id": "entity-06",
        "type": "resource",
        "label": "Synthetic resource 6"
      },
      "epistemic": {
        "origin": "observed",
        "verification": "verified",
        "completeness": "complete",
        "confidence": "high"
      },
      "trust": {
        "privacy": "internal",
        "jurisdiction": "local"
      },
      "health": "healthy",
      "process": {
        "state": "idle",
        "attempt": 1
      },
      "change": "unchanged",
      "provenance": {
        "mode": "tool",
        "sources": [
          "source-a"
        ]
      },
      "time": {
        "kind": "exact",
        "timezone": "Asia/Jakarta"
      },
      "location": null,
      "attention": "normal",
      "representations": [
        "table",
        "inspector",
        "console"
      ]
    },
    {
      "id": "fixture.degraded-retrying",
      "version": 1,
      "entity": {
        "id": "entity-07",
        "type": "resource",
        "label": "Synthetic resource 7"
      },
      "epistemic": {
        "origin": "observed",
        "verification": "verified",
        "completeness": "partial",
        "confidence": "medium"
      },
      "trust": {
        "privacy": "internal",
        "jurisdiction": "local"
      },
      "health": "degraded",
      "process": {
        "state": "retrying",
        "attempt": 1
      },
      "change": "modified",
      "provenance": {
        "mode": "tool",
        "sources": [
          "source-a"
        ]
      },
      "time": {
        "kind": "exact",
        "timezone": "Asia/Jakarta"
      },
      "location": null,
      "attention": "normal",
      "representations": [
        "table",
        "graph",
        "inspector",
        "console"
      ]
    },
    {
      "id": "fixture.cross-border-restricted",
      "version": 1,
      "entity": {
        "id": "entity-08",
        "type": "record",
        "label": "Synthetic record 8"
      },
      "epistemic": {
        "origin": "reported",
        "verification": "verified",
        "completeness": "complete",
        "confidence": "high"
      },
      "trust": {
        "privacy": "restricted",
        "jurisdiction": "cross-border"
      },
      "health": "healthy",
      "process": {
        "state": "blocked",
        "attempt": 1
      },
      "change": "unchanged",
      "provenance": {
        "mode": "human",
        "sources": [
          "source-a"
        ]
      },
      "time": {
        "kind": "exact",
        "timezone": "Asia/Jakarta"
      },
      "location": null,
      "attention": "normal",
      "representations": [
        "table",
        "map",
        "inspector",
        "document",
        "print"
      ]
    },
    {
      "id": "fixture.protected-witness",
      "version": 1,
      "entity": {
        "id": "entity-09",
        "type": "person",
        "label": "Synthetic person 9"
      },
      "epistemic": {
        "origin": "reported",
        "verification": "corroborated",
        "completeness": "partial",
        "confidence": "medium"
      },
      "trust": {
        "privacy": "protected",
        "jurisdiction": "local"
      },
      "health": "healthy",
      "process": {
        "state": "idle",
        "attempt": 1
      },
      "change": "unchanged",
      "provenance": {
        "mode": "human",
        "sources": [
          "source-a"
        ]
      },
      "time": {
        "kind": "exact",
        "timezone": "Asia/Jakarta"
      },
      "location": null,
      "attention": "normal",
      "representations": [
        "table",
        "graph",
        "map",
        "inspector",
        "document"
      ]
    },
    {
      "id": "fixture.time-exact-approx-unknown",
      "version": 1,
      "entity": {
        "id": "entity-10",
        "type": "event",
        "label": "Synthetic event 10"
      },
      "epistemic": {
        "origin": "observed",
        "verification": "verified",
        "completeness": "partial",
        "confidence": "medium"
      },
      "trust": {
        "privacy": "internal",
        "jurisdiction": "local"
      },
      "health": "healthy",